{
  "schema_version": "1.0",
  "content_version": "0.2.0-story-studio-cosmic-balance",
  "entity": "perspective_knowledge_catalog",
  "status": "content_preview",
  "language": "vi",
  "concepts": [],
  "theories": [
    {
      "id": "theory.self_compassion",
      "display_name_vi": "Lòng trắc ẩn với bản thân",
      "original_name": "Self-Compassion",
      "kind": "psychology_theory",
      "summary_vi": "Khung gồm sự tử tế với bản thân, nhận ra tính người chung và giữ trải nghiệm khó khăn trong nhận biết cân bằng thay vì tự phán xét quá mức.",
      "core_truths": [
        {
          "id": "theory.self_compassion.kindness_can_coexist_with_honest_self_view",
          "text_vi": "Nhìn nhận thiếu sót một cách tử tế không loại bỏ trách nhiệm hoặc sự trung thực với điều đã xảy ra.",
          "scope_note_vi": "Không biến self-compassion thành lời đảm bảo rằng mọi hành động đều đúng hoặc không cần sửa chữa."
        }
      ],
      "reference_ids": [
        "ref.neff_2003_self_compassion"
      ],
      "validation_status": "pending_source_review",
      "status": "draft"
    },
    {
      "id": "theory.habit_automaticity",
      "display_name_vi": "Tính tự động của thói quen",
      "original_name": "Habit Automaticity and Context Stability",
      "kind": "psychology_theory",
      "summary_vi": "Nghiên cứu về việc hành vi lặp lại trong bối cảnh ổn định có thể tăng tính tự động và liên kết với tín hiệu quen thuộc.",
      "core_truths": [
        {
          "id": "theory.habit_automaticity.repetition_in_context_leaves_a_path",
          "text_vi": "Những hành động nhỏ được lặp lại trong bối cảnh quen thuộc có thể dần trở thành lối đi dễ được khởi động hơn.",
          "scope_note_vi": "Không hứa hẹn một số ngày cố định để hình thành thói quen hoặc xem tính tự động là yếu tố duy nhất."
        }
      ],
      "reference_ids": [
        "ref.stojanovic_2022_habit_context"
      ],
      "validation_status": "pending_source_review",
      "status": "draft"
    },
    {
      "id": "theory.learning_from_errors",
      "display_name_vi": "Học từ sai sót",
      "original_name": "Learning from Errors",
      "kind": "psychology_theory",
      "summary_vi": "Nghiên cứu cho thấy sai sót có thể hỗ trợ học trong một số điều kiện, đặc biệt khi có nhận biết và phản hồi sửa chữa phù hợp.",
      "core_truths": [
        {
          "id": "theory.learning_from_errors.feedback_can_turn_error_into_information",
          "text_vi": "Một sai sót được nhìn lại cùng phản hồi phù hợp có thể trở thành thông tin cho lần thử tiếp theo.",
          "scope_note_vi": "Không lãng mạn hóa thất bại; sai sót không tự động tạo ra học hỏi nếu thiếu phản hồi hoặc điều kiện an toàn."
        }
      ],
      "reference_ids": [
        "ref.metcalfe_2017_learning_from_errors"
      ],
      "validation_status": "pending_source_review",
      "status": "draft"
    },
    {
      "id": "theory.resilience_ordinary_processes",
      "display_name_vi": "Phục hồi qua những quá trình bình thường",
      "original_name": "Resilience as Ordinary Processes",
      "kind": "psychology_theory",
      "summary_vi": "Khung nhìn resilience như kết quả của nhiều hệ thống thích nghi và nguồn lực bình thường thay vì một phẩm chất phi thường duy nhất.",
      "core_truths": [
        {
          "id": "theory.resilience_ordinary_processes.recovery_can_begin_in_small_ordinary_processes",
          "text_vi": "Sau khó khăn, phục hồi có thể bắt đầu qua nhiều việc nhỏ và nguồn lực quen thuộc trong đời sống.",
          "scope_note_vi": "Không hứa hẹn mọi người sẽ phục hồi theo cùng tốc độ hoặc quy trách nhiệm hoàn toàn cho cá nhân."
        }
      ],
      "reference_ids": [
        "ref.masten_2001_resilience"
      ],
      "validation_status": "pending_source_review",
      "status": "draft"
    },
    {
      "id": "theory.psychological_detachment",
      "display_name_vi": "Tách khỏi công việc để hồi phục",
      "original_name": "Psychological Detachment from Work",
      "kind": "psychology_theory",
      "summary_vi": "Khái niệm về việc tạm ngừng bị cuốn vào yêu cầu và suy nghĩ công việc trong thời gian ngoài công việc để hỗ trợ hồi phục.",
      "core_truths": [
        {
          "id": "theory.psychological_detachment.recovery_needs_some_demands_to_stop",
          "text_vi": "Một hệ thống khó hồi phục nếu những yêu cầu đã làm nó mệt vẫn tiếp tục hoạt động trong thời gian nghỉ.",
          "scope_note_vi": "Không mặc định mọi người có điều kiện công việc hoặc ranh giới thời gian giống nhau."
        }
      ],
      "reference_ids": [
        "ref.wendsche_2017_detachment"
      ],
      "validation_status": "pending_source_review",
      "status": "draft"
    }
  ],
  "frameworks": [],
  "references": [
    {
      "id": "ref.neff_2003_self_compassion",
      "type": "book_or_paper",
      "title": "Self-Compassion: An Alternative Conceptualization of a Healthy Attitude Toward Oneself",
      "authors": [
        "Kristin D. Neff"
      ],
      "year": 2003,
      "publisher_or_journal": "Self and Identity",
      "url": "https://doi.org/10.1080/15298860390129863",
      "language": "en",
      "rights_note": "Chỉ dùng để đối chiếu knowledge; không trích nguyên văn vào Perspective.",
      "validation_status": "pending_source_review"
    },
    {
      "id": "ref.stojanovic_2022_habit_context",
      "type": "book_or_paper",
      "title": "Context Stability in Habit Building Increases Automaticity and Goal Attainment",
      "authors": [
        "M. Stojanovic",
        "A. Grund",
        "S. Fries"
      ],
      "year": 2022,
      "publisher_or_journal": "Frontiers in Psychology",
      "url": "https://pubmed.ncbi.nlm.nih.gov/35756236/",
      "language": "en",
      "rights_note": "Chỉ dùng để đối chiếu knowledge; không trích nguyên văn vào Perspective.",
      "validation_status": "pending_source_review"
    },
    {
      "id": "ref.metcalfe_2017_learning_from_errors",
      "type": "book_or_paper",
      "title": "Learning from Errors",
      "authors": [
        "Janet Metcalfe"
      ],
      "year": 2017,
      "publisher_or_journal": "Annual Review of Psychology",
      "url": "https://pubmed.ncbi.nlm.nih.gov/27648988/",
      "language": "en",
      "rights_note": "Chỉ dùng để đối chiếu knowledge; không trích nguyên văn vào Perspective.",
      "validation_status": "pending_source_review"
    },
    {
      "id": "ref.masten_2001_resilience",
      "type": "book_or_paper",
      "title": "Ordinary magic: Resilience processes in development",
      "authors": [
        "Ann S. Masten"
      ],
      "year": 2001,
      "publisher_or_journal": "American Psychologist",
      "url": "https://pubmed.ncbi.nlm.nih.gov/11315249/",
      "language": "en",
      "rights_note": "Chỉ dùng để đối chiếu knowledge; không trích nguyên văn vào Perspective.",
      "validation_status": "pending_source_review"
    },
    {
      "id": "ref.wendsche_2017_detachment",
      "type": "book_or_paper",
      "title": "A Meta-Analysis on Antecedents and Outcomes of Detachment from Work",
      "authors": [
        "Johannes Wendsche",
        "Andrea Lohmann-Haislah"
      ],
      "year": 2017,
      "publisher_or_journal": "Frontiers in Psychology",
      "url": "https://pubmed.ncbi.nlm.nih.gov/28133454/",
      "language": "en",
      "rights_note": "Chỉ dùng để đối chiếu knowledge; không trích nguyên văn vào Perspective.",
      "validation_status": "pending_source_review"
    }
  ]
}
